{
  "$schema": "../symbols-config-schema.json",
  "projectName": "research-foundry",
  "symbolsDir": "ai",
  "domains": {
    "web": {
      "file": "symbols-web.json",
      "description": "Next.js App Router application - Pages, layouts, route handlers, server and client components. Adjust directories for your app structure.",
      "enabled": true
    },
    "ui": {
      "file": "symbols-ui.json",
      "description": "Shared UI components - Reusable React components, design system primitives, component library.",
      "testFile": "symbols-ui-tests.json",
      "enabled": false
    },
    "api": {
      "file": "symbols-api.json",
      "description": "API routes and handlers - Next.js API routes (app/api), server actions, route handlers.",
      "enabled": true
    },
    "shared": {
      "file": "symbols-shared.json",
      "description": "Shared utilities and types - Type definitions, hooks, utilities, constants used across apps.",
      "enabled": false
    }
  },
  "extraction": {
    "python": {
      "directories": [
        "src/research_foundry"
      ],
      "extensions": [
        ".py"
      ],
      "excludes": [
        "__pycache__",
        "*.pyc"
      ],
      "excludeTests": true,
      "excludePrivate": false
    },
    "typescript": {
      "directories": [
        "frontend/runs-viewer/src"
      ],
      "extensions": [
        ".ts",
        ".tsx",
        ".js",
        ".jsx"
      ],
      "excludes": [
        "node_modules/",
        "*.test.*",
        "*.spec.*",
        "**/*.test.*",
        "**/*.spec.*",
        "**/__tests__/",
        "dist/",
        "build/",
        ".next/",
        "out/",
        "coverage/",
        ".turbo/",
        "*.d.ts",
        "*.stories.*"
      ],
      "excludeTests": true,
      "excludePrivate": false
    }
  },
  "metadata": {
    "version": "1.0",
    "description": "Research Foundry Python research control plane with FastAPI backend and Vite+React runs-viewer frontend. Python source in src/research_foundry, frontend SPA in frontend/runs-viewer/src. Supports symbols extraction for Python (FastAPI routes, services, repositories) and TypeScript (React components, hooks, utilities).",
    "lastUpdated": "2026-06-22T00:00:00.000000Z"
  }
}
